{
  "schemaVersion": "1.0",
  "eventId": "example-mention-001",
  "route": "platform-alerts",
  "title": "Action required",
  "body": "Review the synthetic alert.",
  "severity": "warning",
  "mentions": [
    {
      "kind": "user",
      "alias": "example-owner"
    },
    {
      "kind": "group",
      "alias": "example-responders"
    }
  ]
}
